{
  "protocol_version": "1",
  "request_id": "44444444-4444-4444-8444-444444444444",
  "result": {
    "kind": "verdict",
    "value": { "verdict": "supported" }
  },
  "confidence": { "raw": 0.8, "calibrated": 0.78, "calibration_ref": "calibration-verifier-v1" },
  "disposition": "resolved",
  "uncertainty": null,
  "evidence_refs": [
    {
      "ref": "evidence://sha256/a1a1a1a1a1a1a1a1a1a1a1a1a1a1a1a1a1a1a1a1a1a1a1a1a1a1a1a1a1a1a1a1",
      "kind": "tool_result",
      "trust_tier": "verified",
      "source": "tool:backup-log"
    },
    {
      "ref": "evidence://sha256/c3c3c3c3c3c3c3c3c3c3c3c3c3c3c3c3c3c3c3c3c3c3c3c3c3c3c3c3c3c3c3c3",
      "kind": "registry",
      "trust_tier": "policy",
      "source": "policy:backup-requirements"
    }
  ],
  "backend": "local",
  "latency": { "queue_ms": 3, "load_ms": 2, "inference_ms": 30 },
  "trace_id": "aaaaaaaa-0004-4000-8000-000000000004"
}