{
  "protocol_version": "1",
  "request_id": "11111111-1111-4111-8111-111111111111",
  "result": {
    "kind": "choice",
    "value": { "choices": ["cand-alpha", "cand-beta"] }
  },
  "confidence": { "raw": 0.82, "calibrated": 0.74, "calibration_ref": "calibration-skill-router-v1" },
  "disposition": "resolved",
  "uncertainty": null,
  "evidence_refs": [
    {
      "ref": "evidence://sha256/e0e0e0e0e0e0e0e0e0e0e0e0e0e0e0e0e0e0e0e0e0e0e0e0e0e0e0e0e0e0e0e0",
      "kind": "user_input",
      "trust_tier": "untrusted",
      "source": "user prompt"
    }
  ],
  "backend": "remote",
  "latency": { "queue_ms": 3, "load_ms": 2, "inference_ms": 41 },
  "trace_id": "aaaaaaaa-0001-4000-8000-000000000001"
}