{
  "protocol_version": "1",
  "request_id": "22222222-2222-4222-8222-222222222222",
  "confidence": { "raw": 0.2, "calibrated": 0.18, "calibration_ref": "calibration-risk-judge-v1" },
  "disposition": "abstained",
  "uncertainty": "calibrated confidence is below the worker risk threshold",
  "evidence_refs": [],
  "backend": "remote",
  "latency": { "queue_ms": 5, "load_ms": 1, "inference_ms": 12 },
  "trace_id": "aaaaaaaa-0006-4000-8000-000000000006"
}